{
  "schema": "task-contract-snapshot/v1",
  "capturedAt": "2026-07-17T09:27:21.131Z",
  "capturedBy": "task-create",
  "vertical": "software/coding",
  "preset": {
    "id": "standard-task",
    "version": "2.0.0",
    "digest": "sha256:82510a9275a49a88fb7b4a00809123f3703a0b277e0c04da64baf4cbdad4447c"
  },
  "profile": {
    "id": "baseline",
    "checkerProfile": "standard",
    "completionGates": [
      "ci",
      "code-doc-reconciliation"
    ]
  },
  "templateCatalog": {
    "id": "software-coding-core",
    "version": "1.3.0",
    "digest": "sha256:6fa3ad3c08f969870fbfd30dc36a4e22a2f05cd903f0e374f8120f84558d943e"
  },
  "documents": [
    {
      "slot": "task.plan",
      "templateRef": "template://planning/task-plan@1",
      "materializeAs": "task_plan.md",
      "locale": "en-US",
      "requiredAnchors": [
        "## Goal",
        "## Context",
        "## Constraints",
        "## Checkpoint",
        "## Implementation Plan",
        "## Verification"
      ],
      "bodyDigest": "sha256:b4b2104e7fa898d859af4a22a007bed838e817c580d671a2396ad6c9edc62cd5"
    },
    {
      "slot": "task.progress",
      "templateRef": "template://planning/progress@1",
      "materializeAs": "progress.md",
      "locale": "en-US",
      "requiredAnchors": [
        "## Log",
        "## Evidence"
      ],
      "bodyDigest": "sha256:c16f048629eda47b6fc273191aa0d8d8b9caa91dfa37612afd5d612b91d9d579"
    },
    {
      "slot": "task.facts",
      "templateRef": "template://planning/facts@1",
      "materializeAs": "facts.md",
      "locale": "en-US",
      "requiredAnchors": [
        "## Records"
      ],
      "bodyDigest": "sha256:9b4e281b7626db49e6b042b0d41ddc50148883653a3b17719f2da1847d7d78df"
    },
    {
      "slot": "task.review",
      "templateRef": "template://planning/review@1",
      "materializeAs": "review.md",
      "locale": "en-US",
      "requiredAnchors": [
        "## Reviewer",
        "## Findings"
      ],
      "bodyDigest": "sha256:a4add7e015c257fb5470d161658bb647cf9155fe31f15048e4f0e2214dd305ac"
    },
    {
      "slot": "task.closeout",
      "templateRef": "template://planning/closeout@1",
      "materializeAs": "closeout.md",
      "locale": "en-US",
      "requiredAnchors": [
        "## Summary",
        "## Verification",
        "## Residual Risk"
      ],
      "bodyDigest": "sha256:54c8d6cfcb194a073bd4d7a6883388878a2916f1aabf8761d7e03219486af45b"
    },
    {
      "slot": "task.artifacts.keep",
      "templateRef": "template://planning/keep-file@1",
      "materializeAs": "artifacts/.gitkeep",
      "locale": "en-US",
      "requiredAnchors": [],
      "bodyDigest": "sha256:e3b0c44298fc1c149afbf4c8996fb92427ae41e4649b934ca495991b7852b855"
    }
  ]
}
